{
  "task_id": "T-README-ONBOARDING-001",
  "agent_run_id": null,
  "created_at": "2026-09-14T15:12:24.810Z",
  "context_index_hash": "sha256:ba267ca17484af7c1112c01f6c42ffbf392e89d33039f27dbce3e0747c1f210a",
  "base_revision": "a9d71ec91e127c6cec0b1f1a42130e275f82ab84",
  "budget": {
    "total_tokens": 48000,
    "reserved_output_tokens": 6000,
    "reserved_input_tokens": 2048,
    "estimated_input_tokens": 21140
  },
  "sources": [
    {
      "path": "AGENTS.md",
      "content_hash": "sha256:c107a0b6ee502cfea944746c2207c2b098da52cd7652f8a7b673e6ce06d620e5",
      "git_blob": null,
      "truth_level": "canonical",
      "level": "L0",
      "priority": 0,
      "selection_reason": "Repository governing instructions.; Existing file declared by the current task.",
      "selector": "governing-instructions,task-file-intent",
      "estimated_tokens": 1429,
      "ownership": "project",
      "source_system": null
    },
    {
      "path": ".agent-context/tasks/T-README-ONBOARDING-001/state.yaml",
      "content_hash": "sha256:dc3a0c9375d63dab0d86ad00eb35111e37143bf199cafe0fb0163e27fe9443b1",
      "git_blob": null,
      "truth_level": "active-snapshot",
      "level": "L0",
      "priority": 1,
      "selection_reason": "Current task objective, acceptance criteria, and file intents.",
      "selector": "task-state",
      "estimated_tokens": 495,
      "ownership": "project",
      "source_system": null
    },
    {
      "path": ".agent-context/tasks/T-README-ONBOARDING-001/brief.md",
      "content_hash": "sha256:3a181389d13908f0382a0e300cb3f96a094ae20b55548c4f86b5279fdfcb549b",
      "git_blob": null,
      "truth_level": "active-snapshot",
      "level": "L0",
      "priority": 2,
      "selection_reason": "Current task brief.",
      "selector": "task-brief",
      "estimated_tokens": 1027,
      "ownership": "project",
      "source_system": null
    },
    {
      "path": ".agent-context/tasks/T-README-ONBOARDING-001/change.yaml",
      "content_hash": "sha256:25bcb502a8970db4e9cc888829c359964b93c41e59de10b65cb1234789957f86",
      "git_blob": null,
      "truth_level": "active-snapshot",
      "level": "L0",
      "priority": 3,
      "selection_reason": "Current change decision and acceptance oracle.",
      "selector": "task-change",
      "estimated_tokens": 1297,
      "ownership": "project",
      "source_system": null
    },
    {
      "path": "docs/parallel-work.md",
      "content_hash": "sha256:a37b214f0316b7522570fc26cf91652f9c991074693414b05b03b7ef7d1d9df9",
      "git_blob": "75e5262be56c314337508897ad94457b7a824f7f",
      "truth_level": "design-target",
      "level": "L1",
      "priority": 14,
      "selection_reason": "Weak routing metadata matched 1 normalized semantic task term.",
      "selector": "metadata-routing",
      "estimated_tokens": 1340,
      "ownership": "project",
      "source_system": null
    },
    {
      "path": "examples/resume-history/README.md",
      "content_hash": "sha256:b5dd275bce89f852828b998ae00d87e5d0e183c347a8af957f01666de3070961",
      "git_blob": "40274044c3d5a46341e5e79b351fe8a31e1f5cb5",
      "truth_level": "design-target",
      "level": "L1",
      "priority": 14,
      "selection_reason": "Weak routing metadata shared 2 normalized semantic task terms, but no single routing entry or complete system name established a strong match.",
      "selector": "metadata-routing",
      "estimated_tokens": 766,
      "ownership": "project",
      "source_system": null
    },
    {
      "path": ".agent-context/tasks/T-README-ONBOARDING-001/evidence/local-checks.json",
      "content_hash": "sha256:6ae6dd4a2fdc04970ad2e0c43fadc5edfcc09edb5afc7cf2fa96e85a0ed42377",
      "git_blob": null,
      "truth_level": "historical",
      "level": "L4",
      "priority": 22,
      "selection_reason": "Compact or directly cited task evidence.",
      "selector": "task-evidence-reference",
      "estimated_tokens": 653,
      "ownership": "project",
      "source_system": null
    },
    {
      "path": "docs/alpha-readiness.md",
      "content_hash": "sha256:12bba650807edab24d03201e16aa9cde2fd72b233201529bf32457c39c5d6aef",
      "git_blob": "782568393676bfbef125c7996ace56410db36d90",
      "truth_level": "draft",
      "level": "L3",
      "priority": 25,
      "selection_reason": "Persistently required by the current task state.",
      "selector": "task-required-context",
      "estimated_tokens": 2717,
      "ownership": "project",
      "source_system": null
    },
    {
      "path": "package.json",
      "content_hash": "sha256:5e18c0cb0660a96ce1c90011793214a2b49ca98a79710b623d1ddf3d5c8300ba",
      "git_blob": "d227d9ea45d642fde2f2790697c69061739cb996",
      "truth_level": "unclassified",
      "level": "L3",
      "priority": 25,
      "selection_reason": "Persistently required by the current task state.",
      "selector": "task-required-context",
      "estimated_tokens": 265,
      "ownership": "project",
      "source_system": null
    },
    {
      "path": "README.md",
      "content_hash": "sha256:fe2e4873a76775b60d9957fb389b01786b8620f98610e34af0f17318b216fd3e",
      "git_blob": null,
      "truth_level": "draft",
      "level": "L3",
      "priority": 25,
      "selection_reason": "Persistently required by the current task state.; Existing file declared by the current task.",
      "selector": "task-required-context,task-file-intent",
      "estimated_tokens": 2625,
      "ownership": "project",
      "source_system": null
    },
    {
      "path": "VISION.md",
      "content_hash": "sha256:83a88277367d21d27d3d7fa53e2a915138ef9d62ef39a6999a83b3bb9361f987",
      "git_blob": "5d84c81f54ea344e3dddbac9f6a397e482bab107",
      "truth_level": "canonical",
      "level": "L3",
      "priority": 25,
      "selection_reason": "Persistently required by the current task state.",
      "selector": "task-required-context",
      "estimated_tokens": 2079,
      "ownership": "project",
      "source_system": null
    },
    {
      "path": ".agent-context/config.yaml",
      "content_hash": "sha256:2294f5417bfc6eacce6a95c8be6f23bc149d30bca127d915fc2939a13c95e4a3",
      "git_blob": null,
      "truth_level": "unclassified",
      "level": "L3",
      "priority": 30,
      "selection_reason": "Existing file declared by the current task.",
      "selector": "task-file-intent",
      "estimated_tokens": 109,
      "ownership": "project",
      "source_system": null
    },
    {
      "path": ".agent-context/documentation-plan.yaml",
      "content_hash": "sha256:eb175bafa1ecca2811b331b270fda2e80b26322d55131ace62f168005d48e1d0",
      "git_blob": null,
      "truth_level": "unclassified",
      "level": "L3",
      "priority": 30,
      "selection_reason": "Existing file declared by the current task.",
      "selector": "task-file-intent",
      "estimated_tokens": 287,
      "ownership": "project",
      "source_system": null
    },
    {
      "path": "docs/self-documentation.md",
      "content_hash": "sha256:7cdab0f81ce6540f65d0489732ba68b80b76173a441eac42b098c3d5b9fb8e1b",
      "git_blob": null,
      "truth_level": "draft",
      "level": "L3",
      "priority": 30,
      "selection_reason": "Existing file declared by the current task.",
      "selector": "task-file-intent",
      "estimated_tokens": 953,
      "ownership": "project",
      "source_system": null
    },
    {
      "path": "docs/usage.md",
      "content_hash": "sha256:9a09165fd84412e061c85c7dea9aaa7d7bfea767c0d28a5c9f5bedcf2b48f8eb",
      "git_blob": null,
      "truth_level": "draft",
      "level": "L3",
      "priority": 30,
      "selection_reason": "Existing file declared by the current task.",
      "selector": "task-file-intent",
      "estimated_tokens": 2226,
      "ownership": "project",
      "source_system": null
    },
    {
      "path": "scripts/render-readme.js",
      "content_hash": "sha256:8565d8b62a1c82f7c7ed904ae4dd6ee93971e1032ecf293eab81c33b709e6a1e",
      "git_blob": null,
      "truth_level": "unclassified",
      "level": "L3",
      "priority": 30,
      "selection_reason": "Existing file declared by the current task.",
      "selector": "task-file-intent",
      "estimated_tokens": 485,
      "ownership": "project",
      "source_system": null
    },
    {
      "path": "test/finalize-audit-errors.test.ts",
      "content_hash": "sha256:70036bdd81014a8a3a3413cf96cff6abfa56230698b977dd8e0f63ce3a8ad75d",
      "git_blob": null,
      "truth_level": "unclassified",
      "level": "L3",
      "priority": 30,
      "selection_reason": "Existing file declared by the current task.",
      "selector": "task-file-intent",
      "estimated_tokens": 1968,
      "ownership": "project",
      "source_system": null
    },
    {
      "path": "test/readme.test.ts",
      "content_hash": "sha256:6a40c390b666e3e681b70e92b4307c28f3f4ce18440fcd16120823fbf4ca7210",
      "git_blob": null,
      "truth_level": "unclassified",
      "level": "L3",
      "priority": 30,
      "selection_reason": "Existing file declared by the current task.",
      "selector": "task-file-intent",
      "estimated_tokens": 419,
      "ownership": "project",
      "source_system": null
    }
  ],
  "omissions": [
    {
      "candidate": ".agent-context/tasks/T-README-ONBOARDING-001/handoff.yaml",
      "reason": "No handoff exists for this task yet.",
      "required": false
    },
    {
      "candidate": "docs/assets/canontrail-flow-mobile.svg",
      "reason": "File intent is not a supported text source.",
      "required": false
    },
    {
      "candidate": "docs/assets/canontrail-flow.svg",
      "reason": "File intent is not a supported text source.",
      "required": false
    }
  ],
  "raw_transcripts_included": false,
  "lock_hash": "sha256:dae643e88bd5f84dd133be0e5b2a3fcdccf7722cfa328bcce07ae785653c72a0"
}
