{
  "task_id": "T-SAVE-001",
  "agent_run_id": "session-claude-002",
  "created_at": "2026-07-13T17:05:00+02:00",
  "context_index_hash": "sha256:abe8d3430cd5bde170bb825c288c5e239dcc88723142d66a2a8949f4e32195d3",
  "base_revision": "1ace5a66a761dffbd33e5137a66e7550e968864b",
  "budget": {
    "total_tokens": 32000,
    "reserved_output_tokens": 8000,
    "estimated_input_tokens": 1845
  },
  "sources": [
    {
      "path": "examples/feature-save-schema/task-brief.md",
      "content_hash": "sha256:bfc6bed57871838bbd40f7e1ee9c13114b6bb66b725575b454643f584e34be5f",
      "git_blob": "285fec34afdd3da6e0022c2120d593e4d6605345",
      "truth_level": "active-snapshot",
      "level": "L0",
      "priority": 0,
      "selection_reason": "Contains the imported external task objective.",
      "selector": "task-brief",
      "estimated_tokens": 600,
      "ownership": "project",
      "source_system": null
    },
    {
      "path": "examples/feature-save-schema/project-doc.md",
      "content_hash": "sha256:726ba9eb55a587d27605988a1c4f6458d84abdbcffcb2c35de968027be4cea45",
      "git_blob": "97783620b9da96d2ab1282ef1016693962b3e04b",
      "truth_level": "canonical",
      "level": "L1",
      "priority": 5,
      "selection_reason": "Owns the current save-format contract.",
      "selector": "metadata-routing",
      "estimated_tokens": 800,
      "ownership": "project",
      "source_system": null
    },
    {
      "path": "examples/feature-save-schema/tasks/T-SAVE-001/handoff.yaml",
      "content_hash": "sha256:d1c5a0be8916f019937c5dc6cf06d66427433654c8584ff410a08b2a825887b4",
      "git_blob": null,
      "truth_level": "active-snapshot",
      "level": "L4",
      "priority": 40,
      "selection_reason": "Latest durable checkpoint required for the receiving session.",
      "selector": "explicit-include,latest-handoff",
      "estimated_tokens": 445,
      "ownership": "project",
      "source_system": null
    }
  ],
  "omissions": [
    {
      "candidate": "docs/superpowers/specs/",
      "reason": "The canonical save contract and focused task brief are sufficient for this implementation step.",
      "required": false
    }
  ],
  "raw_transcripts_included": false,
  "lock_hash": "sha256:61b8f331ce74bcd01924347f5b748d88994e39ce806b6added0cc63817bf710c"
}
