{
  "task_id": "T-FROZEN-EXAMPLE-LIFECYCLE-001",
  "agent_run_id": null,
  "created_at": "2026-09-12T17:05:12.563Z",
  "context_index_hash": "sha256:b4177a0eae58b2ffa66f43cc42fab2608e692cb99fd7873a8b8a23301d75a773",
  "budget": {
    "total_tokens": 72000,
    "reserved_output_tokens": 8000,
    "reserved_input_tokens": 2048,
    "estimated_input_tokens": 57728
  },
  "sources": [
    {
      "path": "AGENTS.md",
      "content_hash": "sha256:3e413d0b0e3b78d24abb20535d3a569362fad07a2ec8c7cd62d2f9e4d325d436",
      "git_blob": null,
      "truth_level": "canonical",
      "level": "L0",
      "priority": 0,
      "selection_reason": "Repository governing instructions.",
      "selector": "governing-instructions",
      "estimated_tokens": 1348,
      "ownership": "project",
      "source_system": null
    },
    {
      "path": ".agent-context/tasks/T-FROZEN-EXAMPLE-LIFECYCLE-001/state.yaml",
      "content_hash": "sha256:a261f66fe8319ad8e9bc5f0501f1bd568b1664d72dcd85c570da5d60472ce85c",
      "git_blob": null,
      "truth_level": "active-snapshot",
      "level": "L0",
      "priority": 1,
      "selection_reason": "Current task objective, acceptance criteria, and file intents.",
      "selector": "task-state",
      "estimated_tokens": 445,
      "ownership": "project",
      "source_system": null
    },
    {
      "path": ".agent-context/tasks/T-FROZEN-EXAMPLE-LIFECYCLE-001/brief.md",
      "content_hash": "sha256:4f12169ac4a23cac02a8ac195682c7c66b3ab932ea389378166f35c66495e377",
      "git_blob": null,
      "truth_level": "active-snapshot",
      "level": "L0",
      "priority": 2,
      "selection_reason": "Current task brief.",
      "selector": "task-brief",
      "estimated_tokens": 447,
      "ownership": "project",
      "source_system": null
    },
    {
      "path": ".agent-context/tasks/T-FROZEN-EXAMPLE-LIFECYCLE-001/change.yaml",
      "content_hash": "sha256:f0098848197e3af803db8be67ce045225e75068d89137ece68b2daf31a473a64",
      "git_blob": null,
      "truth_level": "active-snapshot",
      "level": "L0",
      "priority": 3,
      "selection_reason": "Current change decision and acceptance oracle.",
      "selector": "task-change",
      "estimated_tokens": 1509,
      "ownership": "project",
      "source_system": null
    },
    {
      "path": ".agent-context/tasks/T-FROZEN-EXAMPLE-LIFECYCLE-001/evidence/verification.json",
      "content_hash": "sha256:d559d39cb73b3baeda664423dbb5318ccf2a55f536ce60b261b773cc067e3464",
      "git_blob": null,
      "truth_level": "historical",
      "level": "L4",
      "priority": 22,
      "selection_reason": "Compact or directly cited task evidence.",
      "selector": "task-evidence-reference",
      "estimated_tokens": 2570,
      "ownership": "project",
      "source_system": null
    },
    {
      "path": "ARTIFACT_PROTOCOL.md",
      "content_hash": "sha256:958faf518e5dcdfab04aba6f5358409e4897dd08427cddb459481f745658b77f",
      "git_blob": null,
      "truth_level": "design-target",
      "level": "L3",
      "priority": 25,
      "selection_reason": "Persistently required by the current task state.; Existing file declared by the current task.",
      "selector": "task-required-context,task-file-intent",
      "estimated_tokens": 20659,
      "ownership": "project",
      "source_system": null
    },
    {
      "path": "schemas/maintenance.schema.json",
      "content_hash": "sha256:ed0945f89c6193cb9ff5ac7bc307c5faa48c04f52339a9138932983add8e33c8",
      "git_blob": null,
      "truth_level": "unclassified",
      "level": "L3",
      "priority": 25,
      "selection_reason": "Persistently required by the current task state.; Existing file declared by the current task.",
      "selector": "task-required-context,task-file-intent",
      "estimated_tokens": 505,
      "ownership": "project",
      "source_system": null
    },
    {
      "path": "src/docs.ts",
      "content_hash": "sha256:a975b4957dd7bd975601849ca9e8965603f3ade5e9e0611a35155292ed14dedd",
      "git_blob": null,
      "truth_level": "unclassified",
      "level": "L3",
      "priority": 25,
      "selection_reason": "Persistently required by the current task state.; Existing file declared by the current task.",
      "selector": "task-required-context,task-file-intent",
      "estimated_tokens": 6199,
      "ownership": "project",
      "source_system": null
    },
    {
      "path": "src/frozen-examples.ts",
      "content_hash": "sha256:cacfecd511f40743ad553e09b289e8c1126d63d61775981fdb26ef2acea3677b",
      "git_blob": null,
      "truth_level": "unclassified",
      "level": "L3",
      "priority": 25,
      "selection_reason": "Persistently required by the current task state.; Existing file declared by the current task.",
      "selector": "task-required-context,task-file-intent",
      "estimated_tokens": 1227,
      "ownership": "project",
      "source_system": null
    },
    {
      "path": "test/frozen-examples.test.ts",
      "content_hash": "sha256:2b4f0aad7b71675c550f3e723785cb76bfe7688baaeb9a579202d6a0b1f072ef",
      "git_blob": null,
      "truth_level": "unclassified",
      "level": "L3",
      "priority": 25,
      "selection_reason": "Persistently required by the current task state.; Existing file declared by the current task.",
      "selector": "task-required-context,task-file-intent",
      "estimated_tokens": 3759,
      "ownership": "project",
      "source_system": null
    },
    {
      "path": ".agent-context/maintenance.yaml",
      "content_hash": "sha256:7660bcf914789ec5f57d974f8758576fd016fd95673f6f07cbd20bc75272dd98",
      "git_blob": null,
      "truth_level": "unclassified",
      "level": "L3",
      "priority": 30,
      "selection_reason": "Existing file declared by the current task.",
      "selector": "task-file-intent",
      "estimated_tokens": 211,
      "ownership": "project",
      "source_system": null
    },
    {
      "path": "docs/alpha-readiness.md",
      "content_hash": "sha256:e77b45c63358af5b793f60c74e150e56edf7d0cb92658cd1ab786148ae3cb56c",
      "git_blob": null,
      "truth_level": "draft",
      "level": "L3",
      "priority": 30,
      "selection_reason": "Existing file declared by the current task.",
      "selector": "task-file-intent",
      "estimated_tokens": 1182,
      "ownership": "project",
      "source_system": null
    },
    {
      "path": "examples/feature-save-schema/README.md",
      "content_hash": "sha256:1288e1794b76b3e27933acd30d84ac785cd087e7bfa3a771f3d15492dec76efc",
      "git_blob": null,
      "truth_level": "active-snapshot",
      "level": "L3",
      "priority": 30,
      "selection_reason": "Existing file declared by the current task.",
      "selector": "task-file-intent",
      "estimated_tokens": 804,
      "ownership": "project",
      "source_system": null
    },
    {
      "path": "ROADMAP.md",
      "content_hash": "sha256:0a6cc616c4b2e3d6381678f23cb2014a3492b66ebdb2bdb86789c34b6aaa8193",
      "git_blob": null,
      "truth_level": "draft",
      "level": "L3",
      "priority": 30,
      "selection_reason": "Existing file declared by the current task.",
      "selector": "task-file-intent",
      "estimated_tokens": 699,
      "ownership": "project",
      "source_system": null
    },
    {
      "path": "src/validator.ts",
      "content_hash": "sha256:7b4ae9ca54597d6219af3b9c21b47c9fce0499d9f19e9eaa66aab05afb6a0d26",
      "git_blob": null,
      "truth_level": "unclassified",
      "level": "L3",
      "priority": 30,
      "selection_reason": "Existing file declared by the current task.",
      "selector": "task-file-intent",
      "estimated_tokens": 16164,
      "ownership": "project",
      "source_system": null
    }
  ],
  "omissions": [
    {
      "candidate": ".agent-context/tasks/T-FROZEN-EXAMPLE-LIFECYCLE-001/handoff.yaml",
      "reason": "No handoff exists for this task yet.",
      "required": false
    }
  ],
  "raw_transcripts_included": false,
  "lock_hash": "sha256:d151d26ef6a318728418cf654bff65420ccfc14edcf4c8e3efdf34d054af92b4"
}
