{
  "task_id": "T-CONTEXT-BUDGET-CLARITY-001",
  "agent_run_id": null,
  "created_at": "2026-09-25T12:50:42.352Z",
  "context_index_hash": "sha256:fcdc19483ae8d1cfe3908c05e38ae12e0d35b5ce4d1a8ffa61cbe24af0f1a643",
  "budget": {
    "total_tokens": 90000,
    "reserved_output_tokens": 8000,
    "reserved_input_tokens": 1024,
    "estimated_input_tokens": 74112
  },
  "sources": [
    {
      "path": "AGENTS.md",
      "content_hash": "sha256:c107a0b6ee502cfea944746c2207c2b098da52cd7652f8a7b673e6ce06d620e5",
      "git_blob": null,
      "truth_level": "canonical",
      "level": "L0",
      "priority": 0,
      "selection_reason": "Repository governing instructions.",
      "selector": "governing-instructions",
      "estimated_tokens": 1429,
      "ownership": "project",
      "source_system": null
    },
    {
      "path": ".agent-context/tasks/T-CONTEXT-BUDGET-CLARITY-001/state.yaml",
      "content_hash": "sha256:4c69ef91453c311b6932c01bfdb9211472944404b17c091fb0afa6f6f4037b23",
      "git_blob": null,
      "truth_level": "active-snapshot",
      "level": "L0",
      "priority": 1,
      "selection_reason": "Current task objective, acceptance criteria, and file intents.",
      "selector": "task-state",
      "estimated_tokens": 513,
      "ownership": "project",
      "source_system": null
    },
    {
      "path": ".agent-context/tasks/T-CONTEXT-BUDGET-CLARITY-001/brief.md",
      "content_hash": "sha256:e27452cdea9c03d9df1586b5661081597d1be52e9abb9976a03013299ac1935e",
      "git_blob": null,
      "truth_level": "active-snapshot",
      "level": "L0",
      "priority": 2,
      "selection_reason": "Current task brief.",
      "selector": "task-brief",
      "estimated_tokens": 855,
      "ownership": "project",
      "source_system": null
    },
    {
      "path": ".agent-context/tasks/T-CONTEXT-BUDGET-CLARITY-001/change.yaml",
      "content_hash": "sha256:6fd2464f242442e3091695434730a72a2341794b26d7c739c0e63acc7139bfe6",
      "git_blob": null,
      "truth_level": "active-snapshot",
      "level": "L0",
      "priority": 3,
      "selection_reason": "Current change decision and acceptance oracle.",
      "selector": "task-change",
      "estimated_tokens": 1465,
      "ownership": "project",
      "source_system": null
    },
    {
      "path": "docs/parallel-work.md",
      "content_hash": "sha256:a37b214f0316b7522570fc26cf91652f9c991074693414b05b03b7ef7d1d9df9",
      "git_blob": null,
      "truth_level": "design-target",
      "level": "L1",
      "priority": 14,
      "selection_reason": "Weak routing metadata matched 1 normalized semantic task term.",
      "selector": "metadata-routing",
      "estimated_tokens": 1340,
      "ownership": "project",
      "source_system": null
    },
    {
      "path": "integrations/gsd/canontrail/skills/canontrail-finalize/SKILL.md",
      "content_hash": "sha256:2ea4fa240f9c5af18272cd2e3eb9fd851bb8a56ec5f40723fdc60dd6dd43cddd",
      "git_blob": null,
      "truth_level": "design-target",
      "level": "L1",
      "priority": 14,
      "selection_reason": "Weak routing metadata shared 2 normalized semantic task terms, but no single routing entry or complete system name established a strong match.",
      "selector": "metadata-routing",
      "estimated_tokens": 650,
      "ownership": "project",
      "source_system": null
    },
    {
      "path": "integrations/superpowers/skills/canontrail-feature-lifecycle/SKILL.md",
      "content_hash": "sha256:70215fcc77952fb26b660908819b0a7a8126684d6441a0b11ecef44696f778e5",
      "git_blob": null,
      "truth_level": "design-target",
      "level": "L1",
      "priority": 14,
      "selection_reason": "Weak routing metadata matched 1 normalized semantic task term.",
      "selector": "metadata-routing",
      "estimated_tokens": 798,
      "ownership": "project",
      "source_system": null
    },
    {
      "path": ".agent-context/tasks/T-CONTEXT-BUDGET-CLARITY-001/evidence/verification.txt",
      "content_hash": "sha256:95227a44d427fc2d14d6a744c9d093fad8150a1a7f94b18555649d187ca000c7",
      "git_blob": null,
      "truth_level": "historical",
      "level": "L4",
      "priority": 22,
      "selection_reason": "Compact or directly cited task evidence.",
      "selector": "task-evidence-reference",
      "estimated_tokens": 892,
      "ownership": "project",
      "source_system": null
    },
    {
      "path": "ARTIFACT_PROTOCOL.md",
      "content_hash": "sha256:ab7a37b8727ce7145fbcdeee2d040d40fb7a69dc9476356c621b1d0e2ab06dad",
      "git_blob": null,
      "truth_level": "design-target",
      "level": "L3",
      "priority": 25,
      "selection_reason": "Persistently required by the current task state.; Existing file declared by the current task.",
      "selector": "task-required-context,task-file-intent",
      "estimated_tokens": 21278,
      "ownership": "project",
      "source_system": null
    },
    {
      "path": "src/context.ts",
      "content_hash": "sha256:d60d7d2638391435fbffed0a78030a3484933b48e9e6dfb2322ad44b34cb0828",
      "git_blob": null,
      "truth_level": "unclassified",
      "level": "L3",
      "priority": 25,
      "selection_reason": "Persistently required by the current task state.; Existing file declared by the current task.",
      "selector": "task-required-context,task-file-intent",
      "estimated_tokens": 13834,
      "ownership": "project",
      "source_system": null
    },
    {
      "path": "src/finalize.ts",
      "content_hash": "sha256:5d1d7ccf89811bad63ac7b255ded4b1d17e11bc5276df1379d2a72fc0feee93b",
      "git_blob": null,
      "truth_level": "unclassified",
      "level": "L3",
      "priority": 25,
      "selection_reason": "Persistently required by the current task state.; Existing file declared by the current task.",
      "selector": "task-required-context,task-file-intent",
      "estimated_tokens": 3599,
      "ownership": "project",
      "source_system": null
    },
    {
      "path": "VISION.md",
      "content_hash": "sha256:83a88277367d21d27d3d7fa53e2a915138ef9d62ef39a6999a83b3bb9361f987",
      "git_blob": null,
      "truth_level": "canonical",
      "level": "L3",
      "priority": 25,
      "selection_reason": "Persistently required by the current task state.",
      "selector": "task-required-context",
      "estimated_tokens": 2079,
      "ownership": "project",
      "source_system": null
    },
    {
      "path": "docs/usage.md",
      "content_hash": "sha256:943cebd2f1140bbe15ff12b20145a2a4b8115fb757391f1fe8223e6089419867",
      "git_blob": null,
      "truth_level": "draft",
      "level": "L3",
      "priority": 30,
      "selection_reason": "Existing file declared by the current task.",
      "selector": "task-file-intent",
      "estimated_tokens": 2688,
      "ownership": "project",
      "source_system": null
    },
    {
      "path": "examples/context-sections/README.md",
      "content_hash": "sha256:f7cd5105d44a7a0bb7d4dcc3d8b5743597dfd62c945048011e512f64a84dfc59",
      "git_blob": null,
      "truth_level": "active-snapshot",
      "level": "L3",
      "priority": 30,
      "selection_reason": "Existing file declared by the current task.",
      "selector": "task-file-intent",
      "estimated_tokens": 697,
      "ownership": "project",
      "source_system": null
    },
    {
      "path": "test/context-sections.test.ts",
      "content_hash": "sha256:28507d280d940f0c51489b21e7b5f07d574db4ebbfaa80c3da9217c5c846e58f",
      "git_blob": null,
      "truth_level": "unclassified",
      "level": "L3",
      "priority": 30,
      "selection_reason": "Existing file declared by the current task.",
      "selector": "task-file-intent",
      "estimated_tokens": 3484,
      "ownership": "project",
      "source_system": null
    },
    {
      "path": "test/context.test.ts",
      "content_hash": "sha256:65be198e201f314036b2741d7cd7839e6c45a75de5e3b14c44db7aa2a3bb50ce",
      "git_blob": null,
      "truth_level": "unclassified",
      "level": "L3",
      "priority": 30,
      "selection_reason": "Existing file declared by the current task.",
      "selector": "task-file-intent",
      "estimated_tokens": 11674,
      "ownership": "project",
      "source_system": null
    },
    {
      "path": "test/task-scoped-finalize.test.ts",
      "content_hash": "sha256:7657da48b7192d261004a6382135d1021401bc89d3ed6b5226196b2616996a66",
      "git_blob": null,
      "truth_level": "unclassified",
      "level": "L3",
      "priority": 30,
      "selection_reason": "Existing file declared by the current task.",
      "selector": "task-file-intent",
      "estimated_tokens": 6837,
      "ownership": "project",
      "source_system": null
    }
  ],
  "omissions": [
    {
      "candidate": ".agent-context/tasks/T-CONTEXT-BUDGET-CLARITY-001",
      "reason": "File intent is not a supported text source.",
      "required": false
    },
    {
      "candidate": ".agent-context/tasks/T-CONTEXT-BUDGET-CLARITY-001/handoff.yaml",
      "reason": "No handoff exists for this task yet.",
      "required": false
    }
  ],
  "raw_transcripts_included": false,
  "lock_hash": "sha256:a0ccd0bb75dd587366d7a651ce98f82378f414e113ed42b02fdb15aef16dcfd9"
}
